{
  "run_id": "agentcore-customer-support-session-001",
  "metadata": {
    "source": "agentcore_pipeline",
    "adapter_version": "1.0.0",
    "processed_at": "2026-04-06T13:07:24.285662+00:00",
    "segmentation_strategy_used": "TURN_ID",
    "run_confidence": 0.92,
    "mapping_coverage": {
      "ids_coverage": 1.0,
      "time_coverage": 0.85,
      "tool_coverage": 1.0,
      "text_coverage": 1.0,
      "overall_mapping_coverage": 0.96
    }
  },
  "adapter_stats": {
    "total_events_processed": 24,
    "events_with_valid_timestamps": 20,
    "turn_count": 3,
    "confidence_penalties": [
      {
        "reason": "missing_end_timestamp",
        "penalty": 0.05,
        "location": "turn_2"
      }
    ],
    "segmentation_strategy": "TURN_ID",
    "mapping_coverage": 0.96,
    "orphan_tool_results": [],
    "segmentation_strategy_reason": "trace_id used as turn boundary from APPLICATION_LOGS"
  },
  "turns": [
    {
      "turn_id": "turn-1-698cef883d471fd9",
      "request_id": "698cef883d471fd90a7d19ba655b5089",
      "timestamp": "2026-04-01T14:30:00Z",
      "user_query": "What are the warranty support guidelines for premium customers?",
      "final_answer": "For premium customers, our warranty support includes: 1) 24/7 priority phone support, 2) 48-hour replacement guarantee, 3) Extended 3-year coverage on all products, and 4) Dedicated account manager for warranty claims over $500.",
      "finish_reason": "stop",
      "steps": [
        {
          "name": "knowledge_base_retrieval",
          "kind": "TOOL_CALL",
          "status": "success",
          "tool_name": "knowledge_base_lookup",
          "tool_run_id": "tooluse_kb001",
          "start_ts": "2026-04-01T14:30:00.500Z",
          "end_ts": "2026-04-01T14:30:02.100Z",
          "latency_ms": 1600,
          "span_id": "span-001",
          "event_order": 0,
          "attributes": {
            "query": "warranty support premium customers"
          },
          "raw": null
        },
        {
          "name": "knowledge_base_result",
          "kind": "TOOL_RESULT",
          "status": "success",
          "tool_name": "knowledge_base_lookup",
          "tool_run_id": "tooluse_kb001",
          "start_ts": "2026-04-01T14:30:02.100Z",
          "end_ts": "2026-04-01T14:30:02.100Z",
          "latency_ms": 0,
          "span_id": "span-002",
          "event_order": 1,
          "attributes": {
            "chunks_retrieved": 3,
            "relevance_score": 0.94
          },
          "raw": null
        },
        {
          "name": "model_generation",
          "kind": "MODEL_INVOKE",
          "status": "success",
          "tool_name": null,
          "tool_run_id": null,
          "start_ts": "2026-04-01T14:30:02.200Z",
          "end_ts": "2026-04-01T14:30:04.800Z",
          "latency_ms": 2600,
          "span_id": "span-003",
          "event_order": 2,
          "attributes": {
            "model_id": "anthropic.claude-sonnet-4-20250514-v1:0",
            "input_tokens": 1250,
            "output_tokens": 180
          },
          "raw": null
        }
      ],
      "normalized_latency_ms": 4800,
      "runtime_reported_latency_ms": 4750,
      "total_latency_ms": 4800,
      "confidence": 0.95
    },
    {
      "turn_id": "turn-2-698d0a700e10d775",
      "request_id": "698d0a700e10d77545948f32197c8f8d",
      "timestamp": "2026-04-01T14:30:15Z",
      "user_query": "Can you check if order #12345 is eligible for warranty replacement?",
      "final_answer": "I've checked order #12345. This order is for a ProMax Router purchased on 2025-11-15, which is within the 1-year standard warranty period. The customer is on a Premium plan, so they qualify for the 48-hour replacement guarantee. I can initiate the replacement process if you'd like.",
      "finish_reason": "stop",
      "steps": [
        {
          "name": "order_lookup",
          "kind": "TOOL_CALL",
          "status": "success",
          "tool_name": "order_management_api",
          "tool_run_id": "tooluse_order001",
          "start_ts": "2026-04-01T14:30:15.500Z",
          "end_ts": "2026-04-01T14:30:17.200Z",
          "latency_ms": 1700,
          "span_id": "span-004",
          "event_order": 3,
          "attributes": {
            "order_id": "12345"
          },
          "raw": null
        },
        {
          "name": "order_lookup_result",
          "kind": "TOOL_RESULT",
          "status": "success",
          "tool_name": "order_management_api",
          "tool_run_id": "tooluse_order001",
          "start_ts": "2026-04-01T14:30:17.200Z",
          "end_ts": "2026-04-01T14:30:17.200Z",
          "latency_ms": 0,
          "span_id": "span-005",
          "event_order": 4,
          "attributes": {
            "product": "ProMax Router",
            "purchase_date": "2025-11-15",
            "plan": "Premium"
          },
          "raw": null
        },
        {
          "name": "warranty_check",
          "kind": "TOOL_CALL",
          "status": "success",
          "tool_name": "warranty_eligibility_api",
          "tool_run_id": "tooluse_warranty001",
          "start_ts": "2026-04-01T14:30:17.300Z",
          "end_ts": "2026-04-01T14:30:18.500Z",
          "latency_ms": 1200,
          "span_id": "span-006",
          "event_order": 5,
          "attributes": {
            "order_id": "12345"
          },
          "raw": null
        },
        {
          "name": "warranty_check_result",
          "kind": "TOOL_RESULT",
          "status": "success",
          "tool_name": "warranty_eligibility_api",
          "tool_run_id": "tooluse_warranty001",
          "start_ts": "2026-04-01T14:30:18.500Z",
          "end_ts": "2026-04-01T14:30:18.500Z",
          "latency_ms": 0,
          "span_id": "span-007",
          "event_order": 6,
          "attributes": {
            "eligible": true,
            "warranty_type": "premium_48hr_replacement"
          },
          "raw": null
        },
        {
          "name": "model_generation",
          "kind": "MODEL_INVOKE",
          "status": "success",
          "tool_name": null,
          "tool_run_id": null,
          "start_ts": "2026-04-01T14:30:18.600Z",
          "end_ts": "2026-04-01T14:30:21.100Z",
          "latency_ms": 2500,
          "span_id": "span-008",
          "event_order": 7,
          "attributes": {
            "model_id": "anthropic.claude-sonnet-4-20250514-v1:0",
            "input_tokens": 1800,
            "output_tokens": 220
          },
          "raw": null
        }
      ],
      "normalized_latency_ms": 6100,
      "runtime_reported_latency_ms": 6050,
      "total_latency_ms": 6100,
      "confidence": 0.95
    },
    {
      "turn_id": "turn-3-698d1b800f20e886",
      "request_id": "698d1b800f20e88656059f43308d9f9e",
      "timestamp": "2026-04-01T14:30:30Z",
      "user_query": "Yes, please start the replacement. Ship to the address on file.",
      "final_answer": "I've initiated the warranty replacement for order #12345. A new ProMax Router will be shipped to the address on file within 48 hours. The customer will receive a tracking number via email once it ships. The defective unit can be returned using the prepaid label that will be included with the replacement.",
      "finish_reason": "stop",
      "steps": [
        {
          "name": "initiate_replacement",
          "kind": "TOOL_CALL",
          "status": "success",
          "tool_name": "warranty_replacement_api",
          "tool_run_id": "tooluse_replace001",
          "start_ts": "2026-04-01T14:30:30.500Z",
          "end_ts": "2026-04-01T14:30:33.200Z",
          "latency_ms": 2700,
          "span_id": "span-009",
          "event_order": 8,
          "attributes": {
            "order_id": "12345",
            "action": "initiate_replacement"
          },
          "raw": null
        },
        {
          "name": "replacement_result",
          "kind": "TOOL_RESULT",
          "status": "success",
          "tool_name": "warranty_replacement_api",
          "tool_run_id": "tooluse_replace001",
          "start_ts": "2026-04-01T14:30:33.200Z",
          "end_ts": "2026-04-01T14:30:33.200Z",
          "latency_ms": 0,
          "span_id": "span-010",
          "event_order": 9,
          "attributes": {
            "replacement_id": "RPL-67890",
            "estimated_delivery": "48 hours",
            "tracking": "pending"
          },
          "raw": null
        },
        {
          "name": "model_generation",
          "kind": "MODEL_INVOKE",
          "status": "success",
          "tool_name": null,
          "tool_run_id": null,
          "start_ts": "2026-04-01T14:30:33.300Z",
          "end_ts": "2026-04-01T14:30:35.800Z",
          "latency_ms": 2500,
          "span_id": "span-011",
          "event_order": 10,
          "attributes": {
            "model_id": "anthropic.claude-sonnet-4-20250514-v1:0",
            "input_tokens": 2100,
            "output_tokens": 150
          },
          "raw": null
        }
      ],
      "normalized_latency_ms": 5800,
      "runtime_reported_latency_ms": null,
      "total_latency_ms": 5800,
      "confidence": 0.9
    }
  ]
}