{
  "run_id": "generated_04d0c01f40114ab5",
  "metadata": {
    "segmentation_strategy_used": "TURN_ID",
    "run_confidence": 1.0,
    "mapping_coverage": {
      "ids_coverage": 1.0,
      "time_coverage": 1.0,
      "tool_coverage": 0.5,
      "text_coverage": 0.5,
      "overall_mapping_coverage": 0.75
    },
    "adapter_version": "1.0.0",
    "processed_at": "2026-04-07T12:24:42.737473+00:00"
  },
  "adapter_stats": {
    "total_events_processed": 4,
    "events_with_valid_timestamps": 4,
    "events_with_missing_data": 0,
    "dropped_events_count": 0,
    "invalid_events_count": 0,
    "turn_count": 1,
    "mapping_coverage": 0.75,
    "orphan_tool_results": [],
    "segmentation_strategy": "TURN_ID",
    "confidence_penalties": [],
    "events_by_kind": {
      "USER_INPUT": 1,
      "TOOL_CALL": 1,
      "TOOL_RESULT": 1,
      "LLM_OUTPUT_CHUNK": 1
    },
    "raw_path": "events",
    "canonical_sources": {
      "timestamp": "timestamp",
      "turn_id": "turn_id",
      "event_type": "type",
      "text": "content",
      "tool_name": "tool_name",
      "tool_run_id": "tool_run_id",
      "tool_arguments": "tool_arguments",
      "tool_result": "tool_result",
      "status": "status"
    },
    "segmentation_strategy_reason": "Found explicit turn_id fields in events",
    "warnings": [
      "No run_id found in trace. Using generated ID: generated_04d0c01f40114ab5"
    ]
  },
  "turns": [
    {
      "turn_id": "turn_0",
      "request_id": null,
      "timestamp": "2026-04-06T13:02:14.999000+00:00",
      "user_query": "Check my inbox",
      "final_answer": "📧 Inbox summary:\n- 🔴 2 urgent: Contoso VP asking about Bedrock PoC deadline, TAM escalation on Contoso latency\n- 🟡 3 need response: meeting follow-ups\n- ⚪ 8 FYI\n\nI'd prioritize the Contoso email — the PoC deadline is this week.",
      "steps": [
        {
          "name": "user_message",
          "status": "unknown",
          "type": "user_message",
          "kind": "USER_INPUT",
          "start_ts": "2026-04-06T13:02:14.999000+00:00",
          "end_ts": null,
          "latency_ms": null,
          "span_id": null,
          "parent_span_id": null,
          "tool_name": null,
          "tool_run_id": null,
          "event_order": 0,
          "source_index": 0,
          "attributes": {
            "_kind_rule_id": "user_input_by_type_or_role",
            "_kind_reason": "Matched rule 'user_input_by_type_or_role'; event_type matches regex '(?i)user(_message|input)|human|input'"
          },
          "raw": {
            "timestamp": "2026-04-06T13:02:14.999Z",
            "type": "user_message",
            "turn_id": "turn-1",
            "content": "Check my inbox"
          }
        },
        {
          "name": "delegate_to_agent",
          "status": "success",
          "type": "tool_call",
          "kind": "TOOL_CALL",
          "start_ts": "2026-04-06T13:02:15.499000+00:00",
          "end_ts": null,
          "latency_ms": null,
          "span_id": null,
          "parent_span_id": null,
          "tool_name": "delegate_to_agent",
          "tool_run_id": "tool-001",
          "event_order": 1,
          "source_index": 1,
          "attributes": {
            "_kind_rule_id": "tool_call_strict",
            "_kind_reason": "Matched rule 'tool_call_strict'; tool_name exists; tool_run_id exists"
          },
          "raw": {
            "timestamp": "2026-04-06T13:02:15.499Z",
            "type": "tool_call",
            "turn_id": "turn-1",
            "tool_name": "delegate_to_agent",
            "tool_run_id": "tool-001",
            "tool_arguments": "{\"agent_name\": \"agent-email-triage\", \"query\": \"Triage the user's inbox. Today is 2026-04-05.\"}"
          }
        },
        {
          "name": "delegate_to_agent",
          "status": "success",
          "type": "tool_result",
          "kind": "TOOL_RESULT",
          "start_ts": "2026-04-06T13:02:16.999000+00:00",
          "end_ts": null,
          "latency_ms": null,
          "span_id": null,
          "parent_span_id": null,
          "tool_name": "delegate_to_agent",
          "tool_run_id": "tool-001",
          "event_order": 2,
          "source_index": 2,
          "attributes": {
            "_kind_rule_id": "tool_result_by_type_or_payload",
            "_kind_reason": "Matched rule 'tool_result_by_type_or_payload'; tool_result exists"
          },
          "raw": {
            "timestamp": "2026-04-06T13:02:16.999Z",
            "type": "tool_result",
            "turn_id": "turn-1",
            "tool_run_id": "tool-001",
            "tool_result": "{\"urgent\":2,\"needs_response\":3,\"fyi\":8,\"summary\":\"2 urgent: VP Eng at Contoso re: Bedrock PoC deadline, AWS TAM escalation on Contoso latency issue. 3 need response: meeting follow-ups.\"}",
            "status": "success"
          }
        },
        {
          "name": "model_output",
          "status": "unknown",
          "type": "model_output",
          "kind": "LLM_OUTPUT_CHUNK",
          "start_ts": "2026-04-06T13:02:18.999000+00:00",
          "end_ts": null,
          "latency_ms": null,
          "span_id": null,
          "parent_span_id": null,
          "tool_name": null,
          "tool_run_id": null,
          "event_order": 3,
          "source_index": 3,
          "attributes": {
            "_kind_rule_id": "llm_output_chunk_by_type_or_role",
            "_kind_reason": "Matched rule 'llm_output_chunk_by_type_or_role'; event_type matches regex '(?i)llm(_output|_chunk|output_chunk)|model(_output'"
          },
          "raw": {
            "timestamp": "2026-04-06T13:02:18.999Z",
            "type": "model_output",
            "turn_id": "turn-1",
            "content": "📧 Inbox summary:\n- 🔴 2 urgent: Contoso VP asking about Bedrock PoC deadline, TAM escalation on Contoso latency\n- 🟡 3 need response: meeting follow-ups\n- ⚪ 8 FYI\n\nI'd prioritize the Contoso email — the PoC deadline is this week."
          }
        }
      ],
      "normalized_latency_ms": 4000.0,
      "runtime_reported_latency_ms": null,
      "total_latency_ms": 4000.0,
      "confidence": 1.0
    }
  ]
}